{
  "schema_version": "0.1.0",
  "job_type": "style_render",
  "package": {
    "id": "gustave-moreau",
    "name": "古斯塔夫·莫罗",
    "version": "0.2.0",
    "root": "D:\\Projects\\Dog\\OhMyStyle\\style-packages\\artists\\gustave-moreau"
  },
  "model": {
    "name": "provider-neutral",
    "profile": "generic",
    "adapter": "provider-neutral"
  },
  "subject": "One white ceramic cup on a plain tabletop",
  "palette_pair": null,
  "reference_set": "palette",
  "reference_images": [],
  "prompt": "SUBJECT INDEPENDENCE CONTRACT:\nUser subject: One white ceramic cup on a plain tabletop\nUser setting: the user-requested setting\nThe user-supplied subject and setting are authoritative. This package controls visual treatment only: medium, composition, lighting, palette, surface, texture, and edge behavior. Do not add a recurring object, setting, character, landmark, or narrative motif unless the user explicitly requests it. Any concrete noun used below is optional visual vocabulary, not a default subject.\n\nCreate an original image using this package as a visual language, not as a fixed subject or copied composition.\n\nPackage signature:\n- 精细而有方向感的线条与装饰性曲线\n- 宝石蓝、深红、金色和墨绿形成高密度色彩层\n- 平面细节与梦境空间叠合\n- 局部精密、整体保持神秘的表面节奏\n\nSubject rule:\nKeep the user-supplied subject, object count, location, action, and narrative unchanged. Do not add a recurring motif, landmark, named character, or story event from the representative image.\n\nReproduction direction:\n- 先确定清晰的主体轮廓和主要色块\n- 用细线与装饰性曲线建立内部秩序\n- 叠加宝石色、金色和深色阴影\n- 让细节集中在视觉焦点，背景保持可呼吸\n\nUser request:\nOne white ceramic cup on a plain tabletop\nthe user-requested composition\nthe user-requested aspect ratio\n\nExact package assignment:\nFollow the package-defined visual signature, process, materials, and constraints exactly.\nUse any supplied reference images for palette relationship only, not for subject identity or copied composition.",
  "negative_prompt": "Do not copy a reference composition, named character, landmark, logo, brand, readable text, screenshot, watermark, or protected game asset. Do not introduce a fixed subject from the package. Avoid generic global filters, accidental extra objects, and unrequested narrative events.",
  "template_variables": {
    "SUBJECT": "One white ceramic cup on a plain tabletop",
    "LOCATION": "the user-requested setting"
  },
  "unresolved_placeholders": [],
  "constraints": {
    "area_ratio": {},
    "profiles": {
      "symbolic-line-color-enigma": {
        "required": [
          "requested subject identity, silhouette, and count remain readable",
          "precise contour and arabesque line rhythm are visible",
          "jewel-like color planes interact deliberately with line",
          "fine detail is selective and creates a clear focal hierarchy"
        ],
        "reject_if": [
          "unrequested mythological, biblical, or religious narrative appears",
          "gold or ornamental detail becomes an all-over filter",
          "arbitrary fantasy scenery replaces the requested setting"
        ]
      },
      "generic": {
        "required": [
          "package-specific visual signature is observable",
          "composition remains coherent for a new subject",
          "no copied reference composition or branded material",
          "no fixed subject leaks into the output"
        ],
        "reject_if": [
          "style is represented only by a global color filter",
          "text, logo, watermark, or unintended signature is present"
        ]
      },
      "portrait": {
        "required": [
          "preserve the user-supplied person or object without adding a recurring figure"
        ]
      },
      "still_life": {
        "required": [
          "preserve the user-supplied objects and their count"
        ]
      }
    }
  },
  "provenance": {
    "source_policy": "A primary source is recorded below; verify redistribution rights before bundling any image.",
    "reference_usage": "Reference images are inputs to the render job; they are not silently inferred."
  }
}
