{
  "schema_version": "0.1.0",
  "job_type": "style_render",
  "package": {
    "id": "artemisia-gentileschi",
    "name": "阿尔泰米西娅·真蒂莱斯基",
    "version": "0.2.0",
    "root": "D:\\Projects\\Dog\\OhMyStyle\\style-packages\\artists\\artemisia-gentileschi"
  },
  "model": {
    "name": "provider-neutral",
    "profile": "generic",
    "adapter": "provider-neutral"
  },
  "subject": "A person catching a brass pot before it falls in a dim kitchen",
  "palette_pair": null,
  "reference_set": "none",
  "reference_images": [],
  "prompt": "SUBJECT INDEPENDENCE CONTRACT:\nUser subject: A person catching a brass pot before it falls in a dim kitchen\nUser setting: the user-requested setting\nThe user-supplied subject and setting are authoritative. This package controls\nvisual treatment only: medium, composition, lighting, palette, surface,\ntexture, and edge behavior. Do not add a recurring object, setting, character,\nlandmark, or narrative motif unless the user explicitly requests it. Any\nconcrete noun used below is optional visual vocabulary, not a default subject.\n\nCreate a new subject and composition using these observable visual decisions:\n- 人物以强烈对角线和近距离动作挤压画面，形成有力的叙事瞬间\n- 主体与背景保持清楚的层级关系，并让新主题拥有独立构图。\n- 深黑、血红、赭金、钴蓝与象牙白形成高对比巴洛克色组\n- 颜色按角色分配，不把调色板当作覆盖全画面的滤镜。\n- 写实油画与大胆的肉身造型\n- 媒介边缘、形体和细节密度保持一致。\n- 单一侧上方光源切出人物与布料，背景沉入深暗\n- 光源方向和明暗层次服务于空间与主体，而不是制造无来源效果。\n- 皮肤、金属、粗布和木材通过触感对比增强张力\n- 不同材质保留可辨识的表面行为。\n- 笔触紧贴动作方向，局部高光集中于手臂和面部\n- 纹理沿结构和媒介方向组织，远景与次要区域降低密度。\n- 保留强烈明暗与身体能量，不复刻圣经人物、暴力场面或原作动作\n- 不得复制来源作品的具体人物、地标、文字、标志、道具或构图。\nKeep the medium, lighting, palette roles, surface behavior, and edge language coherent. Do not copy any reference work, named character, location, logo, text, or exact arrangement.\n\nExact package assignment:\nFollow the package-defined visual signature, process, materials, and constraints exactly.\nUse any supplied reference images for palette relationship only, not for subject identity or copied composition.",
  "negative_prompt": "- copied composition or recognizable source scene\n- unmotivated style mixing\n- generic global color filter\n- unreadable subject or broken geometry\n- extra logos, readable text, or watermarks\n- copied_named_work\n- recognizable_source_arrangement\n- readable_logo_or_text\n- generic_global_filter",
  "template_variables": {
    "SUBJECT": "A person catching a brass pot before it falls in a dim kitchen",
    "LOCATION": "the user-requested setting"
  },
  "unresolved_placeholders": [],
  "constraints": {
    "area_ratio": {},
    "profiles": {
      "figure_action": {
        "required": [
          "requested action reads through clear body and object directions",
          "close staging retains enough space to understand the action",
          "localized color and shadow preserve figure and material readability"
        ],
        "reject_if": [
          "conflict, weapon, injury, or historical narrative appears without request",
          "crop hides the action's cause or consequence",
          "light and dark flatten into a generic dramatic filter"
        ]
      }
    }
  },
  "provenance": {
    "source_policy": "External works and game materials are recorded as links for research and visual analysis only. They are not bundled or redistributed.",
    "reference_usage": "Reference images are inputs to the render job; they are not silently inferred."
  }
}
