{
  "schema_version": "0.1.0",
  "job_type": "style_render",
  "package": {
    "id": "francisco-goya",
    "name": "弗朗西斯科·戈雅",
    "version": "0.2.0",
    "root": "D:\\Projects\\Dog\\OhMyStyle\\style-packages\\artists\\francisco-goya"
  },
  "model": {
    "name": "provider-neutral",
    "profile": "generic",
    "adapter": "provider-neutral"
  },
  "subject": "A retired lighthouse keeper in a worn wool jacket, looking down thoughtfully",
  "palette_pair": null,
  "reference_set": "palette",
  "reference_images": [],
  "prompt": "SUBJECT INDEPENDENCE CONTRACT:\nUser subject: A retired lighthouse keeper in a worn wool jacket, looking down thoughtfully\nUser setting: the user-requested setting\nThe user-supplied subject and setting are authoritative. This package controls\nvisual treatment only: medium, composition, lighting, palette, surface,\ntexture, and edge behavior. Do not add a recurring object, setting, character,\nlandmark, or narrative motif unless the user explicitly requests it. Any\nconcrete noun used below is optional visual vocabulary, not a default subject.\n\nCreate a new painting image with psychological tension, muted earth and ash gray, rough painterly surface, solitary figure, quiet unease. Use a new subject and arrangement; make the medium and surface behavior observable; keep the focal hierarchy readable; do not imitate a named artwork or exact composition.\n\nExact package assignment:\nFollow the package-defined visual signature, process, materials, and constraints exactly.\nUse any supplied reference images for palette relationship only, not for subject identity or copied composition.",
  "negative_prompt": "copied named artwork, recognizable reconstruction, generic global style filter, unrelated extra style, unreadable subject, logo, trademark, watermark, arbitrary text",
  "template_variables": {
    "SUBJECT": "A retired lighthouse keeper in a worn wool jacket, looking down thoughtfully",
    "LOCATION": "the user-requested setting"
  },
  "unresolved_placeholders": [],
  "constraints": {
    "area_ratio": {},
    "profiles": {
      "psychological-portrait": {
        "required": [
          "sitter's requested expression and identity remain recognizable",
          "paint detail and mark scale distinguish focal features from background",
          "restrained value contrast supports face readability"
        ],
        "reject_if": [
          "unrequested violence, grotesque imagery, or self-portrait identity appears",
          "direct gaze is forced against the user's request",
          "global roughness or black overlay replaces selective painted marks"
        ]
      }
    }
  },
  "provenance": {
    "source_policy": "",
    "reference_usage": "Reference images are inputs to the render job; they are not silently inferred."
  }
}
