{
  "schema_version": "0.1.0",
  "job_type": "style_render",
  "package": {
    "id": "titian",
    "name": "提香",
    "version": "0.2.0",
    "root": "D:\\Projects\\Dog\\OhMyStyle\\style-packages\\artists\\titian"
  },
  "model": {
    "name": "provider-neutral",
    "profile": "generic",
    "adapter": "provider-neutral"
  },
  "subject": "One ripe red pear resting partly on deep blue wool cloth on a small table, against a warm ochre plaster wall; soft side light; layered oil painting, horizontal 16:9.",
  "palette_pair": null,
  "reference_set": "palette",
  "reference_images": [],
  "prompt": "SUBJECT INDEPENDENCE CONTRACT:\n- The user-supplied One ripe red pear resting partly on deep blue wool cloth on a small table, against a warm ochre plaster wall; soft side light; layered oil painting, horizontal 16:9. and the user-requested setting are authoritative.\n- This package controls visual treatment only: medium, composition, lighting,\n  palette, surface, texture, and edge behavior.\n- Do not add a recurring object, setting, character, landmark, cultural identity,\n  or narrative motif unless the user explicitly requests it.\n\nCreate a new image of One ripe red pear resting partly on deep blue wool cloth on a small table, against a warm ochre plaster wall; soft side light; layered oil painting, horizontal 16:9. in the user-requested setting. Apply the package's observable\nmedium, composition, lighting, palette, surface, and texture decisions from the\nstyle files. Preserve the package invariants while inventing a new scene: do not\ncopy any reference work, named character, exact pose, recognizable layout, logo,\nor text. Keep the subject and narrative supplied by the user independent from\nthe package's visual identity. Use concrete visual instructions rather than the\npackage name alone.\n\nExact package assignment:\nFollow the package-defined visual signature, process, materials, and constraints exactly.\nUse any supplied reference images for palette relationship only, not for subject identity or copied composition.",
  "negative_prompt": "copied reference composition, recognizable character, logo, watermark, artist signature, unintended text, generic global color filter, fixed landmark, fixed narrative motif, duplicate objects, malformed anatomy, plastic CGI finish",
  "template_variables": {
    "SUBJECT": "One ripe red pear resting partly on deep blue wool cloth on a small table, against a warm ochre plaster wall; soft side light; layered oil painting, horizontal 16:9.",
    "LOCATION": "the user-requested setting"
  },
  "unresolved_placeholders": [],
  "constraints": {
    "area_ratio": {},
    "profiles": {
      "generic": {
        "required": [
          "package-specific visual signature is observable",
          "composition remains coherent for a new subject",
          "no copied reference composition or branded material",
          "no fixed subject leaks into the output"
        ],
        "reject_if": [
          "style is represented only by a global color filter",
          "text, logo, watermark, or unintended signature is present"
        ]
      },
      "portrait": {
        "required": [
          "preserve the user-supplied person or object without adding a recurring figure"
        ]
      },
      "still_life": {
        "required": [
          "preserve the user-supplied objects and their count"
        ]
      }
    }
  },
  "provenance": {
    "source_policy": "A primary source is recorded below; verify redistribution rights before bundling any image.",
    "reference_usage": "Reference images are inputs to the render job; they are not silently inferred."
  }
}
