{
  "schema_version": "0.1.0",
  "job_type": "style_render",
  "package": {
    "id": "joan-mitchell",
    "name": "琼·米切尔",
    "version": "0.2.0",
    "root": "D:\\Projects\\Dog\\OhMyStyle\\style-packages\\artists\\joan-mitchell"
  },
  "model": {
    "name": "provider-neutral",
    "profile": "generic",
    "adapter": "provider-neutral"
  },
  "subject": "A horizontal abstract field with cobalt and olive horizontal strokes at left, short yellow vertical strokes near center, and a violet diagonal cluster at right, separated by broad warm-white ground; no objects or horizon",
  "palette_pair": null,
  "reference_set": "palette",
  "reference_images": [],
  "prompt": "SUBJECT INDEPENDENCE CONTRACT:\n- The user-supplied A horizontal abstract field with cobalt and olive horizontal strokes at left, short yellow vertical strokes near center, and a violet diagonal cluster at right, separated by broad warm-white ground; no objects or horizon and the user-requested setting are authoritative.\n- This package controls visual treatment only: medium, composition, lighting,\n  palette, surface, texture, and edge behavior.\n- Do not add a recurring object, setting, character, landmark, or narrative\n  motif unless the user explicitly requests it.\n\nCreate a new image of A horizontal abstract field with cobalt and olive horizontal strokes at left, short yellow vertical strokes near center, and a violet diagonal cluster at right, separated by broad warm-white ground; no objects or horizon in the user-requested setting. Treat it as an expressive painting\nwith a warm-white ground, large broken directional brush groups, exposed pauses,\nscraped passages, a few thin drips and tactile variation in paint thickness. Use\ndeep blue, green, rust red, ochre and violet as related but distinct stroke\nfamilies. Let the user's subject remain recognizable beneath the abstraction. Keep\nthe composition open and asymmetrical, with varied density rather than an even\nall-over pattern. Do not add a landscape, tree, garden, named scene or narrative\nmotif unless requested. Do not copy any reference work, exact pose, recognizable\nlayout, logo, or text. Use concrete visual instructions rather than the package\nname alone.\n\nExact package assignment:\nFollow the package-defined visual signature, process, materials, and constraints exactly.\nUse any supplied reference images for palette relationship only, not for subject identity or copied composition.",
  "negative_prompt": "copied reference composition, recognizable character, logo, watermark, artist signature,\nunintended text, generic global color filter, incompatible medium, accidental photorealism,\nunmotivated neon, plastic CGI finish, smooth digital gradient, uniform decorative pattern,\nforced mountains, forced trees, forced garden, fixed landscape, malformed anatomy, duplicate objects",
  "template_variables": {
    "SUBJECT": "A horizontal abstract field with cobalt and olive horizontal strokes at left, short yellow vertical strokes near center, and a violet diagonal cluster at right, separated by broad warm-white ground; no objects or horizon",
    "LOCATION": "the user-requested setting"
  },
  "unresolved_placeholders": [],
  "constraints": {
    "area_ratio": {},
    "profiles": {
      "counterposed-color-stroke-groups": {
        "required": [
          "distinct brush groups use counterposed directions and varied stroke weights",
          "the requested ground remains visible between color clusters",
          "thick and thin paint passages create local depth without a global filter",
          "the requested subject or abstract arrangement remains recognizable"
        ],
        "reject_if": [
          "strokes fill the whole image as uniform texture or an all-over web",
          "all clusters share one direction, length, and density",
          "unrequested horizon, trees, flowers, or landscape objects appear"
        ]
      },
      "generic": {
        "required": [
          "package-specific visual signature is observable",
          "composition remains coherent for a new subject",
          "no copied reference composition or branded material"
        ],
        "reject_if": [
          "style is represented only by a global color filter",
          "text, logo, watermark, or unintended signature is present"
        ]
      },
      "portrait": {
        "required": [
          "brush groups support the requested likeness instead of replacing facial structure",
          "exposed ground and directional paint remain visible without obscuring the subject"
        ]
      },
      "still_life": {
        "required": [
          "object silhouettes remain legible beneath broken paint passages",
          "color clusters vary in density and do not become a repeated decorative pattern"
        ]
      }
    }
  },
  "provenance": {
    "source_policy": "A primary source is recorded below; verify redistribution rights before bundling any image.",
    "reference_usage": "Reference images are inputs to the render job; they are not silently inferred."
  }
}
