{
  "schema_version": "0.1.0",
  "job_type": "style_render",
  "package": {
    "id": "paul-cezanne",
    "name": "保罗·塞尚",
    "version": "0.2.0",
    "root": "D:\\Projects\\Dog\\OhMyStyle\\style-packages\\artists\\paul-cezanne"
  },
  "model": {
    "name": "provider-neutral",
    "profile": "generic",
    "adapter": "provider-neutral"
  },
  "subject": "A blue ceramic bowl holding exactly three pears, on a wooden table with exactly one folded ivory cloth, horizontal 16:9.",
  "palette_pair": null,
  "reference_set": "palette",
  "reference_images": [],
  "prompt": "SUBJECT INDEPENDENCE CONTRACT:\nUser subject: A blue ceramic bowl holding exactly three pears, on a wooden table with exactly one folded ivory cloth, horizontal 16:9.\nUser setting: the user-requested setting\nThe user-supplied subject and setting are authoritative. This package controls\nvisual treatment only: medium, composition, lighting, palette, surface,\ntexture, and edge behavior. Do not add a recurring object, setting, character,\nlandmark, or narrative motif unless the user explicitly requests it. Any\nconcrete noun used below is optional visual vocabulary, not a default subject.\n\nCreate a new oil painting of a previously unseen still life or landscape. Build every major form from interlocking warm and cool color planes, with repeated short directional brush marks that follow tables, cloth, fruit, trunks, walls, or hills. Allow slight tension between local axes and the overall perspective while keeping objects solid and readable. Use blue-green, muted ochre, vermilion, cream, violet-gray, and deep blue as a restrained structural palette. Avoid smooth airbrush modeling; let adjacent color construct volume. The subject and arrangement must be new.\n\nExact package assignment:\nFollow the package-defined visual signature, process, materials, and constraints exactly.\nUse any supplied reference images for palette relationship only, not for subject identity or copied composition.",
  "negative_prompt": "Do not use the artist's name, a copied still life, famous mountain composition, random scribbles, cubist fragmentation, photorealistic lens rendering, plastic smoothness, generic impasto filter, text, logos, or watermark.",
  "template_variables": {
    "SUBJECT": "A blue ceramic bowl holding exactly three pears, on a wooden table with exactly one folded ivory cloth, horizontal 16:9.",
    "LOCATION": "the user-requested setting"
  },
  "unresolved_placeholders": [],
  "constraints": {
    "area_ratio": {},
    "profiles": {}
  },
  "provenance": {
    "source_policy": "Historical works are bundled only where the cited source marks the work or reproduction public domain; generated examples are new anonymous scenes.",
    "reference_usage": "Reference images are inputs to the render job; they are not silently inferred."
  }
}
