{
  "schema_version": "0.1.0",
  "job_type": "style_render",
  "package": {
    "id": "rembrandt",
    "name": "伦勃朗·范·莱因",
    "version": "0.2.0",
    "root": "D:\\Projects\\Dog\\OhMyStyle\\style-packages\\artists\\rembrandt"
  },
  "model": {
    "name": "provider-neutral",
    "profile": "generic",
    "adapter": "provider-neutral"
  },
  "subject": "One anonymous adult in a plain dark sweater quietly examines a small brass key held between the fingers near a single shaded table lamp; one visible face and clear hand-object contact, intimate horizontal 16:9 portrait.",
  "palette_pair": null,
  "reference_set": "palette",
  "reference_images": [],
  "prompt": "SUBJECT INDEPENDENCE CONTRACT:\nUser subject: One anonymous adult in a plain dark sweater quietly examines a small brass key held between the fingers near a single shaded table lamp; one visible face and clear hand-object contact, intimate horizontal 16:9 portrait.\nUser setting: the user-requested setting\nThe user-supplied subject and setting are authoritative. This package controls\nvisual treatment only: medium, composition, lighting, palette, surface,\ntexture, and edge behavior. Do not add a recurring object, setting, character,\nlandmark, or narrative motif unless the user explicitly requests it. Any\nconcrete noun used below is optional visual vocabulary, not a default subject.\n\nCreate an original oil painting of One anonymous adult in a plain dark sweater quietly examines a small brass key held between the fingers near a single shaded table lamp; one visible face and clear hand-object contact, intimate horizontal 16:9 portrait. in the user-requested setting. Establish a warm\number ground and one dominant directional light path through a large dark field.\nLet the light reveal the psychological presence of the face, hands, or central\ngesture, while deep shadows retain warm structure and material detail. Use warm\nblack, umber, muted red, ochre gold, and restrained old ivory. Model skin with\ncontinuous transitions; model cloth, wood, and metal with selective loaded paint\nand broken highlights. Keep the composition asymmetrical, intimate, and quiet.\nThe result must be a new scene, not a brown filter, generic movie chiaroscuro, or\nreconstruction of any named painting.\n\nExact package assignment:\nFollow the package-defined visual signature, process, materials, and constraints exactly.\nUse any supplied reference images for palette relationship only, not for subject identity or copied composition.",
  "negative_prompt": "uniform sepia filter, crushed black background, theatrical spotlight, generic\ncinematic chiaroscuro, plastic skin, glossy digital painting, neon, copied famous\npainting, recognizable artwork recreation, artist signature, watermark, logo, text",
  "template_variables": {
    "SUBJECT": "One anonymous adult in a plain dark sweater quietly examines a small brass key held between the fingers near a single shaded table lamp; one visible face and clear hand-object contact, intimate horizontal 16:9 portrait.",
    "LOCATION": "the user-requested setting"
  },
  "unresolved_placeholders": [],
  "constraints": {
    "area_ratio": {},
    "profiles": {}
  },
  "provenance": {
    "source_policy": "Historical works are bundled from public-domain reproductions; the generated example is an anonymous new scene.",
    "reference_usage": "Reference images are inputs to the render job; they are not silently inferred."
  }
}
