{
  "schema_version": "0.1.0",
  "job_type": "style_render",
  "package": {
    "id": "jan-van-eyck",
    "name": "扬·凡·艾克",
    "version": "0.2.0",
    "root": "D:\\Projects\\Dog\\OhMyStyle\\style-packages\\artists\\jan-van-eyck"
  },
  "model": {
    "name": "provider-neutral",
    "profile": "generic",
    "adapter": "provider-neutral"
  },
  "subject": "A small green glass bottle, a folded cream linen cloth, and a tarnished brass key on a pale wooden tabletop, softly lit by a nearby window",
  "palette_pair": null,
  "reference_set": "palette",
  "reference_images": [],
  "prompt": "SUBJECT INDEPENDENCE CONTRACT:\nUser subject: A small green glass bottle, a folded cream linen cloth, and a tarnished brass key on a pale wooden tabletop, softly lit by a nearby window\nUser setting: the user-requested setting\nThe user-supplied subject and setting are authoritative. This package controls\nvisual treatment only: medium, composition, lighting, palette, surface,\ntexture, and edge behavior. Do not add a recurring object, setting, character,\nlandmark, or narrative motif unless the user explicitly requests it. Any\nconcrete noun used below is optional visual vocabulary, not a default subject.\n\nCreate a new subject and composition using these observable visual decisions:\n- 室内正面空间、镜面反射和精密小物共同构成静默的仪式感\n- 主体与背景保持清楚的层级关系，并让新主题拥有独立构图。\n- 深红、橄榄绿、木棕、蓝灰与珍珠白形成宝石般低亮色组\n- 颜色按角色分配，不把调色板当作覆盖全画面的滤镜。\n- 细密油画、透明釉层和高精度细节\n- 媒介边缘、形体和细节密度保持一致。\n- 窗侧自然光轻轻掠过织物、金属和玻璃\n- 光源方向和明暗层次服务于空间与主体，而不是制造无来源效果。\n- 木材、毛皮、金属、玻璃和织物必须各自可辨\n- 不同材质保留可辨识的表面行为。\n- 表面细节集中在前景物件，背景保持稳定而不喧宾夺主\n- 纹理沿结构和媒介方向组织，远景与次要区域降低密度。\n- 保持细密光学观察与室内秩序，不复制镜子、人物或婚礼构图\n- 不得复制来源作品的具体人物、地标、文字、标志、道具或构图。\nKeep the medium, lighting, palette roles, surface behavior, and edge language coherent. Do not copy any reference work, named character, location, logo, text, or exact arrangement.\n\nExact package assignment:\nFollow the package-defined visual signature, process, materials, and constraints exactly.\nUse any supplied reference images for palette relationship only, not for subject identity or copied composition.",
  "negative_prompt": "- copied composition or recognizable source scene\n- unmotivated style mixing\n- generic global color filter\n- unreadable subject or broken geometry\n- extra logos, readable text, or watermarks\n- copied_named_work\n- recognizable_source_arrangement\n- readable_logo_or_text\n- generic_global_filter",
  "template_variables": {
    "SUBJECT": "A small green glass bottle, a folded cream linen cloth, and a tarnished brass key on a pale wooden tabletop, softly lit by a nearby window",
    "LOCATION": "the user-requested setting"
  },
  "unresolved_placeholders": [],
  "constraints": {
    "area_ratio": {},
    "profiles": {
      "glazed-material-observation": {
        "required": [
          "requested objects and their material identities remain intact",
          "highlights and edge sharpness differ by material rather than sharing one gloss",
          "thin color layers deepen selected passages without obscuring their base color",
          "fine detail is selective and supports form, light, or material"
        ],
        "reject_if": [
          "every surface receives the same mirror-like shine",
          "unrequested mirrors, inscriptions, figures, or symbolic props are introduced",
          "detail density becomes uniform noise across focal and secondary areas"
        ]
      }
    }
  },
  "provenance": {
    "source_policy": "External works and game materials are recorded as links for research and visual analysis only. They are not bundled or redistributed.",
    "reference_usage": "Reference images are inputs to the render job; they are not silently inferred."
  }
}
