{
  "schema_version": "0.1.0",
  "job_type": "style_render",
  "package": {
    "id": "grant-wood",
    "name": "格兰特·伍德",
    "version": "0.2.0",
    "root": "D:\\Projects\\Dog\\OhMyStyle\\style-packages\\artists\\grant-wood"
  },
  "model": {
    "name": "provider-neutral",
    "profile": "generic",
    "adapter": "provider-neutral"
  },
  "subject": "A postal cyclist passing a stone orchard wall in late autumn",
  "palette_pair": null,
  "reference_set": "palette",
  "reference_images": [],
  "prompt": "SUBJECT INDEPENDENCE CONTRACT:\nUser subject: A postal cyclist passing a stone orchard wall in late autumn\nUser setting: the user-requested setting\nThe user-supplied subject and setting are authoritative. This package controls\nvisual treatment only: medium, composition, lighting, palette, surface,\ntexture, and edge behavior. Do not add a recurring object, setting, character,\nlandmark, or narrative motif unless the user explicitly requests it. Any\nconcrete noun used below is optional visual vocabulary, not a default subject.\n\nCreate a new painting image with precise rural geometry, vertical forms, cool clear sky, controlled detail, muted green blue and brown. Use a new subject and arrangement; make the medium and surface behavior observable; keep the focal hierarchy readable; do not imitate a named artwork or exact composition.\n\nExact package assignment:\nFollow the package-defined visual signature, process, materials, and constraints exactly.\nUse any supplied reference images for palette relationship only, not for subject identity or copied composition.",
  "negative_prompt": "copied named artwork, recognizable reconstruction, generic global style filter, unrelated extra style, unreadable subject, logo, trademark, watermark, arbitrary text",
  "template_variables": {
    "SUBJECT": "A postal cyclist passing a stone orchard wall in late autumn",
    "LOCATION": "the user-requested setting"
  },
  "unresolved_placeholders": [],
  "constraints": {
    "area_ratio": {},
    "profiles": {
      "composed-regional-landscape": {
        "required": [
          "requested activity and location remain primary",
          "rolling forms and vertical accents establish deliberate landscape rhythm",
          "a path or gesture leads the eye when it fits the scene"
        ],
        "reject_if": [
          "iconic Grant Wood figures, pitchfork, or copied triangular arrangement appear",
          "unrequested farm or Midwest details replace the requested setting",
          "uniform detail or global color wash flattens the focal hierarchy"
        ]
      }
    }
  },
  "provenance": {
    "source_policy": "",
    "reference_usage": "Reference images are inputs to the render job; they are not silently inferred."
  }
}
