{
  "schema_version": "0.1.0",
  "job_type": "style_render",
  "package": {
    "id": "francisco-de-zurbaran",
    "name": "弗朗西斯科·德·苏巴朗",
    "version": "0.2.0",
    "root": "D:\\Projects\\Dog\\OhMyStyle\\style-packages\\artists\\francisco-de-zurbaran"
  },
  "model": {
    "name": "provider-neutral",
    "profile": "generic",
    "adapter": "provider-neutral"
  },
  "subject": "One blue ceramic teapot and one folded linen cloth on a plain wooden table",
  "palette_pair": null,
  "reference_set": "palette",
  "reference_images": [],
  "prompt": "SUBJECT INDEPENDENCE CONTRACT:\nUser subject: One blue ceramic teapot and one folded linen cloth on a plain wooden table\nUser setting: the user-requested setting\nThe user-supplied subject and setting are authoritative. This package controls\nvisual treatment only: medium, composition, lighting, palette, surface,\ntexture, and edge behavior. Do not add a recurring object, setting, character,\nlandmark, or narrative motif unless the user explicitly requests it. Any\nconcrete noun used below is optional visual vocabulary, not a default subject.\n\nCreate a new subject and composition using these observable visual decisions:\n- 孤立主体、安静的几何体和大面积暗背景制造修道院式静默\n- 主体与背景保持清楚的层级关系，并让新主题拥有独立构图。\n- 炭黑、灰白、赭褐、暗红和少量金黄形成克制色组\n- 颜色按角色分配，不把调色板当作覆盖全画面的滤镜。\n- 静物与人物的雕塑性油画\n- 媒介边缘、形体和细节密度保持一致。\n- 窄束侧光打亮主体，暗部保留结构而非完全吞没\n- 光源方向和明暗层次服务于空间与主体，而不是制造无来源效果。\n- 粗布、陶器、木材和皮肤呈现干燥、重量感表面\n- 不同材质保留可辨识的表面行为。\n- 纹理简洁，轮廓和衣褶形成清楚的体积边界\n- 纹理沿结构和媒介方向组织，远景与次要区域降低密度。\n- 保持朴素、沉静和物体重量，不添加华丽戏剧或复制宗教人物\n- 不得复制来源作品的具体人物、地标、文字、标志、道具或构图。\nKeep the medium, lighting, palette roles, surface behavior, and edge language coherent. Do not copy any reference work, named character, location, logo, text, or exact arrangement.\n\nExact package assignment:\nFollow the package-defined visual signature, process, materials, and constraints exactly.\nUse any supplied reference images for palette relationship only, not for subject identity or copied composition.",
  "negative_prompt": "- copied composition or recognizable source scene\n- unmotivated style mixing\n- generic global color filter\n- unreadable subject or broken geometry\n- extra logos, readable text, or watermarks\n- copied_named_work\n- recognizable_source_arrangement\n- readable_logo_or_text\n- generic_global_filter",
  "template_variables": {
    "SUBJECT": "One blue ceramic teapot and one folded linen cloth on a plain wooden table",
    "LOCATION": "the user-requested setting"
  },
  "unresolved_placeholders": [],
  "constraints": {
    "area_ratio": {},
    "profiles": {
      "ordered-object-still-life": {
        "required": [
          "requested object identities and count stay unchanged",
          "spacing between requested objects remains deliberate and legible",
          "one consistent lateral light reveals volume and material"
        ],
        "reject_if": [
          "unrequested citrus, rose, vessels, devotional imagery, or props appear",
          "the layout copies a named source painting",
          "shadows become unreadable or materials receive uniform surface treatment"
        ]
      }
    }
  },
  "provenance": {
    "source_policy": "External works and game materials are recorded as links for research and visual analysis only. They are not bundled or redistributed.",
    "reference_usage": "Reference images are inputs to the render job; they are not silently inferred."
  }
}
